{
  "tools": [
    {
      "type": "function",
      "function": {
        "name": "get_weather",
        "description": "Get current weather for a location.",
        "parameters": {
          "type": "object",
          "properties": {
            "location": {
              "type": "string",
              "description": "City name"
            }
          },
          "required": [
            "location"
          ]
        }
      }
    }
  ],
  "messages": [
    {
      "role": "user",
      "content": [
        {
          "type": "text",
          "text": "What is the weather in London and Paris?"
        }
      ]
    },
    {
      "role": "assistant",
      "tool_calls": [
        {
          "type": "function",
          "function": {
            "name": "get_weather",
            "arguments": {
              "location": "London"
            }
          }
        },
        {
          "type": "function",
          "function": {
            "name": "get_weather",
            "arguments": {
              "location": "Paris"
            }
          }
        }
      ]
    },
    {
      "role": "tool",
      "content": [
        {
          "type": "tool_response",
          "name": "get_weather",
          "response": {
            "location": "London",
            "temperature": "18C"
          }
        },
        {
          "type": "tool_response",
          "name": "get_weather",
          "response": {
            "location": "Paris",
            "temperature": "22C"
          }
        }
      ]
    }
  ],
  "add_generation_prompt": true,
  "bos_token": "<|startoftext|>"
}
